,id,name,lat,lng,category,address,address2,city,state,postal,country,phone,web,features,modalities,searchGoogle,search,ct,ct_areas,echo,echo_areas,mr,mr_areas,nuclear,nuclear_areas,vascular,vascular_areas,pediatric_echo,pediatric_echo_areas,ct-dental,ct-dental_areas,stenting,stenting_areas,vein_center,vein_center_areas,cardiac_electrophysiology,cardiac_electrophysiology_areas,cardiovascular_catheterization,cardiovascular_catheterization_areas,jrcdms,jrcdms_areas
323,324,Max MRI Imaging,34.161631,-118.51516,granted,17530 Ventura Blvd,Suite 105,Encino,CA,91316,USA,,maxmrimaging.com,,mr,,Max MRI Imaging Encino,,,,,"Mar 31, 2024","Musculoskeletal MRI, Neurological MRI",,,,,,,,,,,,,,,,,,
324,325,"Max MRI Imaging, Inc.",33.925421,-118.158683,granted,7711 Amigos Ave,Suite C,Downey,CA,90241,USA,,www.maxmrimaging.com,,mr,,"Max MRI Imaging, Inc. Downey",,,,,"Mar 31, 2024","Musculoskeletal MRI, Neurological MRI, MRA",,,,,,,,,,,,,,,,,,
325,326,"Max MRI Imaging, Inc.",32.622034,-117.072364,granted,865 Third Ave Suite 121,,Chula Vista,CA,91911,USA,,www.maxmrimaging.com,,mr,,"Max MRI Imaging, Inc. Chula Vista",,,,,"Mar 31, 2024","Musculoskeletal MRI, Neurological MRI, MRA",,,,,,,,,,,,,,,,,,
326,327,"Maxview, Inc.",38.746955,-121.259988,multigranted,1830 Sierra Gardens Drive 30,,Roseville,CA,95661,USA,,,,"ct, mr","www.google.com/search?q=Maxview,+Inc.","Maxview, Inc. Roseville","Nov 30, 2022","Body CT, Neurological CT, Maxillofacial CT",,,"Jan 31, 2024","Musculoskeletal MRI, Neurological MRI, MRA",,,,,,,,,,,,,,,,,,
327,328,MD Office Solutions,37.639352,-122.133437,granted,23595 Cabot Blvd,Suite 113,Hayward,CA,94545,USA,,www.mdofficesolutions.com,,nuclear,,MD Office Solutions Hayward,,,,,,,"Jun 30, 2024",Myocardial Perfusion Imaging,,,,,,,,,,,,,,,,
328,329,"Medical Advocate, Inc.",33.967019,-118.03268,granted,8038 Painter Ave,,Whittier,CA,90602,USA,,,,nuclear,"www.google.com/search?q=Medical+Advocate,+Inc.","Medical Advocate, Inc. Whittier",,,,,,,"Jul 31, 2025",Myocardial Perfusion Imaging,,,,,,,,,,,,,,,,
329,330,"Mehrdad Kevin Ariani, M.D.",34.220768,-118.53412,granted,18350 Roscoe Blvd Suite 401,,Northridge,CA,91325,USA,,,,nuclear,"www.google.com/search?q=Mehrdad+Kevin+Ariani,+M.D.","Mehrdad Kevin Ariani, M.D. Northridge",,,,,,,"Mar 31, 2024",Myocardial Perfusion Imaging,,,,,,,,,,,,,,,,
330,331,"Mehrdad Kevin Ariani, M.D., Inc.",34.220768,-118.53412,granted,"18350 Roscoe Boulevard, Suite 400",,Northridge,CA,91325,USA,,,,nuclear,"www.google.com/search?q=Mehrdad+Kevin+Ariani,+M.D.,+Inc.","Mehrdad Kevin Ariani, M.D., Inc. Northridge",,,,,,,"Sep 30, 2022",Positron Emission Tomography (PET),,,,,,,,,,,,,,,,
331,332,"Mehrdad Rezaee, M.D. Cardiac and Vascular Care",37.327084,-121.934048,granted,2030 Forest Avenue Suite 210,,San Jose,CA,95128,USA,,,,nuclear,"www.google.com/search?q=Mehrdad+Rezaee,+M.D.+Cardiac+and+Vascular+Care","Mehrdad Rezaee, M.D. Cardiac and Vascular Care San Jose",,,,,,,"Jun 30, 2024",Myocardial Perfusion Imaging,,,,,,,,,,,,,,,,
332,333,"Memorial Cardiology Medical Group, Inc.",33.809669,-118.186813,granted,2898 Linden Ave.,,Long Beach,CA,90806,USA,,,,nuclear,"www.google.com/search?q=Memorial+Cardiology+Medical+Group,+Inc.","Memorial Cardiology Medical Group, Inc. Long Beach",,,,,,,"May 31, 2023","Myocardial Perfusion Imaging, Positron Emission Tomography (PET)",,,,,,,,,,,,,,,,
333,334,MemorialCare Long Beach Medical Center Miller Children’s and Women’s Hospital,33.807107,-118.185098,granted,2801 Atlantic Blvd,,Long Beach,CA,90801,USA,,,,pediatric_echo,www.google.com/search?q=MemorialCare+Long+Beach+Medical+Center+Miller+Children’s+and+Women’s+Hospital,MemorialCare Long Beach Medical Center Miller Children’s and Women’s Hospital Long Beach,,,,,,,,,,,"Oct 30, 2022",Pediatric Transthoracic,,,,,,,,,,,,
334,335,MemorialCare Medical Foundation,33.828428,-118.147999,granted,"3828 Schaufele Ave, Ste 200",,Long Beach,CA,90808,USA,,,,nuclear,www.google.com/search?q=MemorialCare+Medical+Foundation,MemorialCare Medical Foundation Long Beach,,,,,,,"Jul 31, 2025",Myocardial Perfusion Imaging,,,,,,,,,,,,,,,,
335,336,MemorialCare Miller Children’s Hospital Long Beach Outpatient Services Pediatric Cardiology,33.815211,-118.349573,granted,3640 Lomita Boulevard,Suite 102,Torrance,CA,90505,USA,,millerchildrens.org,,pediatric_echo,,MemorialCare Miller Children’s Hospital Long Beach Outpatient Services Pediatric Cardiology Torrance,,,,,,,,,,,"Oct 30, 2022",Pediatric Transthoracic,,,,,,,,,,,,
336,337,MemorialCare Miller Children’s Outpatient Pediatric Specialty Center Pediatric Cardiology,33.809376,-118.184967,granted,2701 Atlantic Avenue,"4th Floor, Suite 8",Long Beach,CA,90806,USA,,millerchildrens.org,,pediatric_echo,,MemorialCare Miller Children’s Outpatient Pediatric Specialty Center Pediatric Cardiology Long Beach,,,,,,,,,,,"Oct 30, 2022",Pediatric Transthoracic,,,,,,,,,,,,
337,338,"Mercy Medical Group, a Service of Dignity Health Medical Foundation",38.41984,-121.4064,granted,9394 Big Horn Blvd,,Elk Grove,CA,95758,USA,,,,nuclear,"www.google.com/search?q=Mercy+Medical+Group,+a+Service+of+Dignity+Health+Medical+Foundation","Mercy Medical Group, a Service of Dignity Health Medical Foundation Elk Grove",,,,,,,"Feb 28, 2023",Myocardial Perfusion Imaging,,,,,,,,,,,,,,,,
338,339,"Mercy Medical Group, a service of Dignity Health Medical Foundation",38.569726,-121.453763,granted,3941 J Street,Suite #364 North,Sacramento,CA,95819,USA,,www.mymercymedicalgroup.org,,nuclear,,"Mercy Medical Group, a service of Dignity Health Medical Foundation Sacramento",,,,,,,"Feb 28, 2023",Myocardial Perfusion Imaging,,,,,,,,,,,,,,,,
339,340,Mill-Peninsula Health Services - San Mateo,37.565593,-122.325314,granted,100 S. San Mateo Drive,,San Mateo,CA,94401,USA,,,,vascular,www.google.com/search?q=Mill-Peninsula+Health+Services+-+San+Mateo,Mill-Peninsula Health Services - San Mateo San Mateo,,,,,,,,,"Apr 30, 2025",Extracranial Cerebrovascular Testing,,,,,,,,,,,,,,
340,341,Mills Health Center,37.565593,-122.325314,granted,100 S. San Mateo Dr.,,San Mateo,CA,94401,USA,,www.mills-peninsula.org,,echo,,Mills Health Center San Mateo,,,"Oct 31, 2023",Adult Transthoracic,,,,,,,,,,,,,,,,,,,,
341,342,Mills Peninsula Health Services,37.594398,-122.383356,granted,1501 Trousdale Drive,Room 2779,Burlingame,CA,94010,USA,,www.mills-peninsula.org,,vascular,,Mills Peninsula Health Services Burlingame,,,,,,,,,"Apr 30, 2025",Extracranial Cerebrovascular Testing,,,,,,,,,,,,,,
342,343,Mills Peninsula Health Services,37.594398,-122.383356,granted,1501 Trousdale Dr.,,Burlingame,CA,94010,USA,,www.mills-peninsula.org,,echo,,Mills Peninsula Health Services Burlingame,,,"Oct 31, 2023",Adult Transthoracic,,,,,,,,,,,,,,,,,,,,
343,344,Mint Medical at Alameda Health System  Alameda Hospital Campus,37.76323,-122.253541,granted,2070 Clinton Ave,,Alameda,CA,94501,,,,,vascular,www.google.com/search?q=Mint+Medical+at+Alameda+Health+System++Alameda+Hospital+Campus,Mint Medical at Alameda Health System  Alameda Hospital Campus Alameda,,,,,,,,,"Nov 30, 2022","Extracranial Cerebrovascular Testing, Peripheral Arterial Testing, Peripheral Venous Testing",,,,,,,,,,,,,,
344,345,Mint Medical at Alameda Health System - Highland Campus,37.799234,-122.231199,granted,1411 East 31st Street,Acute Care Tower - Radiology,Oakland,CA,94602,USA,,,,vascular,www.google.com/search?q=Mint+Medical+at+Alameda+Health+System+-+Highland+Campus,Mint Medical at Alameda Health System - Highland Campus Oakland,,,,,,,,,"Nov 30, 2022","Extracranial Cerebrovascular Testing, Peripheral Arterial Testing, Peripheral Venous Testing",,,,,,,,,,,,,,
345,346,Mint Medical at Alameda Health System - San Leandro Hospital,37.714632,-122.141973,granted,13855 E 14th St,,San Leandro,CA,94578,,,,,vascular,www.google.com/search?q=Mint+Medical+at+Alameda+Health+System+-+San+Leandro+Hospital,Mint Medical at Alameda Health System - San Leandro Hospital San Leandro,,,,,,,,,"Nov 30, 2022","Extracranial Cerebrovascular Testing, Peripheral Arterial Testing, Peripheral Venous Testing",,,,,,,,,,,,,,
346,347,Mint Medical at Kaiser Permanente Oakland Campus,37.823327,-122.259244,granted,3600 Broadway,,Oakland,CA,94611,USA,,,,vascular,www.google.com/search?q=Mint+Medical+at+Kaiser+Permanente+Oakland+Campus,Mint Medical at Kaiser Permanente Oakland Campus Oakland,,,,,,,,,"Nov 30, 2022","Extracranial Cerebrovascular Testing, Peripheral Arterial Testing, Peripheral Venous Testing",,,,,,,,,,,,,,
347,348,Mint Medical at Kaiser Permanente Redwood City Campus,37.489519,-122.223278,granted,1100 Veterans Boulevard,Oak Building,Redwood City,CA,94063,USA,,,,vascular,www.google.com/search?q=Mint+Medical+at+Kaiser+Permanente+Redwood+City+Campus,Mint Medical at Kaiser Permanente Redwood City Campus Redwood City,,,,,,,,,"Nov 30, 2024","Extracranial Cerebrovascular Testing, Peripheral Arterial Testing, Peripheral Venous Testing",,,,,,,,,,,,,,
348,349,Mint Medical at Kaiser Permanente San Jose Campus,37.239324,-121.801248,granted,280 Hospital Parkway,Building A,San Jose,CA,95119,USA,,,,vascular,www.google.com/search?q=Mint+Medical+at+Kaiser+Permanente+San+Jose+Campus,Mint Medical at Kaiser Permanente San Jose Campus San Jose,,,,,,,,,"Nov 30, 2024","Extracranial Cerebrovascular Testing, Peripheral Arterial Testing, Peripheral Venous Testing",,,,,,,,,,,,,,
349,350,Mint Medical at Kaiser Permanente Santa Clara Homestead Campus,37.335574,-121.995768,granted,710 Lawrence Expressway,M 290,Santa Clara,CA,95051,USA,,,,vascular,www.google.com/search?q=Mint+Medical+at+Kaiser+Permanente+Santa+Clara+Homestead+Campus,Mint Medical at Kaiser Permanente Santa Clara Homestead Campus Santa Clara,,,,,,,,,"Nov 30, 2024","Extracranial Cerebrovascular Testing, Peripheral Arterial Testing, Peripheral Venous Testing, Visceral Vascular Testing",,,,,,,,,,,,,,
350,351,Mint Medical at Kaiser Permanente South San Francisco Campus,37.658376,-122.439205,granted,1200 El Camino Real,Vascular Lab - Surgery Department,South San Francisco,CA,94080,USA,,,,vascular,www.google.com/search?q=Mint+Medical+at+Kaiser+Permanente+South+San+Francisco+Campus,Mint Medical at Kaiser Permanente South San Francisco Campus South San Francisco,,,,,,,,,"Nov 30, 2022","Peripheral Arterial Testing, Peripheral Venous Testing",,,,,,,,,,,,,,
351,352,Mission Hospital,33.561184,-117.66704,granted,27700 Medical Center Road,,Mission Viejo,CA,92691,USA,,mission4health.com,,echo,,Mission Hospital Mission Viejo,,,"Jun 30, 2025",Adult Transthoracic,,,,,,,,,,,,,,,,,,,,
352,353,Modern Nuclear Incorporated,33.927775,-117.933129,granted,511 S. Harbor Blvd. Bldg. E,,La Habra,CA,90631,USA,,,,nuclear,www.google.com/search?q=Modern+Nuclear+Incorporated,Modern Nuclear Incorporated La Habra,,,,,,,"Jul 31, 2025","Myocardial Perfusion Imaging, Positron Emission Tomography (PET)",,,,,,,,,,,,,,,,
353,354,"Mohammed Ashraf, M.D.",36.944921,-120.04358,granted,1260 E Almond Ave,,Madera,CA,93637,USA,,,,nuclear,"www.google.com/search?q=Mohammed+Ashraf,+M.D.","Mohammed Ashraf, M.D. Madera",,,,,,,"Jun 30, 2024",Myocardial Perfusion Imaging,,,,,,,,,,,,,,,,
354,355,Montclair Open Mri,34.092778,-117.689531,granted,8891 Central Ave,Suite C,Montclair,CA,91763,USA,,,,mr,www.google.com/search?q=Montclair+Open+Mri,Montclair Open Mri Montclair,,,,,"Feb 28, 2025","Musculoskeletal MRI, Neurological MRI",,,,,,,,,,,,,,,,,,
355,356,Monterey Bay Cardiovascular Center,36.931269,-121.779241,granted,73 Penny Lane,,Watsonville,CA,95076,USA,,,,nuclear,www.google.com/search?q=Monterey+Bay+Cardiovascular+Center,Monterey Bay Cardiovascular Center Watsonville,,,,,,,"Nov 30, 2023",Myocardial Perfusion Imaging,,,,,,,,,,,,,,,,
356,357,MyCardiologist Heart Specialists of Orange County,33.755857,-117.834222,granted,1200 N. Tustin Ave.,Ste. 260,Santa Ana,CA,92705,USA,,,,nuclear,www.google.com/search?q=MyCardiologist+Heart+Specialists+of+Orange+County,MyCardiologist Heart Specialists of Orange County Santa Ana,,,,,,,"May 31, 2023",Myocardial Perfusion Imaging,,,,,,,,,,,,,,,,
357,358,"N.R. Devaraj, MD, FACC, Inc.",33.817286,-118.007439,granted,3356 W. Ball Rd. 205,,Anaheim,CA,92804,USA,,,,nuclear,"www.google.com/search?q=N.R.+Devaraj,+MD,+FACC,+Inc.","N.R. Devaraj, MD, FACC, Inc. Anaheim",,,,,,,"May 31, 2023",Myocardial Perfusion Imaging,,,,,,,,,,,,,,,,
358,359,N.X. Nguyen M.D. Comprehensive Ears Nose Throat,33.703378,-117.989061,granted,17822 Beach Blvd.,Suite 474,Huntington Beach,CA,92647,USA,,www.earnosethroatdoctor.com,,ct,,N.X. Nguyen M.D. Comprehensive Ears Nose Throat Huntington Beach,"Jan 31, 2023",Maxillofacial CT,,,,,,,,,,,,,,,,,,,,,,
359,360,"Nabil Abudayeh, M.D.",37.718472,-122.084844,granted,20700 Lake Chabot Rd,Suite 107,Casto Valley,CA,94546,USA,,,,nuclear,"www.google.com/search?q=Nabil+Abudayeh,+M.D.","Nabil Abudayeh, M.D. Casto Valley",,,,,,,"Jun 30, 2024",Myocardial Perfusion Imaging,,,,,,,,,,,,,,,,
360,361,"Namik, LLC",32.891593,-117.193056,granted,5330 Carroll Canyon Road,Suite 140,San Diego,CA,92121,USA,,,,vein_center,"www.google.com/search?q=Namik,+LLC","Namik, LLC San Diego",,,,,,,,,,,,,,,,,"Aug 31, 2022",Superficial Venous Evaluation and Management,,,,,,
361,362,"Natalie MacLean, MD A Prof Co",33.054033,-117.285564,granted,345 Saxony Rd. Suite 105,,Encinitas,CA,92024,USA,,,,mr,"www.google.com/search?q=Natalie+MacLean,+MD+A+Prof+Co","Natalie MacLean, MD A Prof Co Encinitas",,,,,"Jun 30, 2024",Musculoskeletal MRI,,,,,,,,,,,,,,,,,,
362,363,National Radiological Imaging Associates,38.418564,-121.395664,granted,9281 Office Park Cir. 115,,Elk Grove,CA,95758,USA,,,,mr,www.google.com/search?q=National+Radiological+Imaging+Associates,National Radiological Imaging Associates Elk Grove,,,,,"Jan 31, 2024","Musculoskeletal MRI, Neurological MRI, MRA",,,,,,,,,,,,,,,,,,
363,364,"National Stand Up Imaging, LLC DBA Dynamic Upright MRI",34.062495,-118.354316,granted,5757 Wilshire Blvd Ste P8,,Los Angeles,CA,90036,USA,,WWW.DYNAMICUPRIGHTMRI.COM,,mr,,"National Stand Up Imaging, LLC DBA Dynamic Upright MRI Los Angeles",,,,,"Oct 31, 2023","Musculoskeletal MRI, Neurological MRI",,,,,,,,,,,,,,,,,,
364,365,Newport Coast Cardiology,33.630526,-117.929102,granted,520 Superior Avenue,Suite 325,Newport Beach,CA,92663,USA,,,,echo,www.google.com/search?q=Newport+Coast+Cardiology,Newport Coast Cardiology Newport Beach,,,"Jan 31, 2024","Adult Stress, Adult Transthoracic",,,,,,,,,,,,,,,,,,,,
365,366,Newport Heart Medical Group,33.626328,-117.92657,granted,415 Old Newport Blvd,Suite 200,Newport Beach,CA,92663,USA,,www.newportheart.com,,echo,,Newport Heart Medical Group Newport Beach,,,"Aug 31, 2024",Adult Transthoracic,,,,,,,,,,,,,,,,,,,,
366,367,Noninvasive Vascular Laboratory,37.71455,-122.141858,granted,13851 E. 14th St,,San Leandro,CA,94578,USA,,,,vascular,www.google.com/search?q=Noninvasive+Vascular+Laboratory,Noninvasive Vascular Laboratory San Leandro,,,,,,,,,"Jun 30, 2025","Extracranial Cerebrovascular Testing, Peripheral Arterial Testing, Peripheral Venous Testing, Visceral Vascular Testing",,,,,,,,,,,,,,
367,368,Noninvasive Vascular Laboratory at Keck Hospital of USC,34.062168,-118.203234,granted,1500 San Pablo,,Los Angeles,CA,90033,USA,,,,vascular,www.google.com/search?q=Noninvasive+Vascular+Laboratory+at+Keck+Hospital+of+USC,Noninvasive Vascular Laboratory at Keck Hospital of USC Los Angeles,,,,,,,,,"Apr 30, 2024","Extracranial Cerebrovascular Testing, Peripheral Arterial Testing, Peripheral Venous Testing, Visceral Vascular Testing",,,,,,,,,,,,,,
368,369,Noninvasive Vascular Laboratory at St Rose Hospital,37.63291,-122.089742,granted,27200 Calaroga Ave,,Hayward,CA,94545,USA,,vasculargroup.com,,vascular,,Noninvasive Vascular Laboratory at St Rose Hospital Hayward,,,,,,,,,"Jun 30, 2025","Extracranial Cerebrovascular Testing, Peripheral Arterial Testing, Peripheral Venous Testing, Visceral Vascular Testing",,,,,,,,,,,,,,
369,370,Noninvasive Vascular Labortory San Ramon Physicians,37.77229,-121.989867,granted,100 Park Place,Suite 150,San Ramon,CA,94583,USA,,vasculargroup.com,,vascular,,Noninvasive Vascular Labortory San Ramon Physicians San Ramon,,,,,,,,,"Jun 30, 2025","Extracranial Cerebrovascular Testing, Peripheral Arterial Testing, Peripheral Venous Testing, Visceral Vascular Testing",,,,,,,,,,,,,,
370,371,NORTH BAY HEALTHCARE GROUP,38.261961,-122.049896,granted,1860 Pennsylvania Ave,,Fairfield,CA,94533,USA,,,,nuclear,www.google.com/search?q=NORTH+BAY+HEALTHCARE+GROUP,NORTH BAY HEALTHCARE GROUP Fairfield,,,,,,,"May 31, 2024",Myocardial Perfusion Imaging,,,,,,,,,,,,,,,,
371,372,North Coast Vascular Institute,40.786702,-124.13968,granted,2321 Harrison Avenue,,Eureka,CA,95501,USA,,,,vascular,www.google.com/search?q=North+Coast+Vascular+Institute,North Coast Vascular Institute Eureka,,,,,,,,,"Sep 30, 2023","Extracranial Cerebrovascular Testing, Peripheral Arterial Testing, Peripheral Venous Testing, Visceral Vascular Testing",,,,,,,,,,,,,,
372,373,Northbay Healthcare,38.261114,-122.049052,granted,1200 B Gale Wilson Boulevard,,Fairfield,CA,94533,USA,,,,echo,www.google.com/search?q=Northbay+Healthcare,Northbay Healthcare Fairfield,,,"May 31, 2024","Adult Stress, Adult Transthoracic",,,,,,,,,,,,,,,,,,,,
373,374,Northbay Heart and Vascular Center,38.26197,-122.04931,granted,1860 Pennsylvania Ave Ste 120,,Fairfield,CA,94533,USA,,www.northbay.org/,,echo,,Northbay Heart and Vascular Center Fairfield,,,"May 31, 2024","Adult Stress, Adult Transthoracic",,,,,,,,,,,,,,,,,,,,
374,375,"Northern California Medical Assoc, Inc.",38.448648,-122.699094,granted,1701 Fourth St.,Suite 120,Santa Rosa,CA,95404,USA,,ncmahealth.com,,ct,,"Northern California Medical Assoc, Inc. Santa Rosa","May 31, 2024",Maxillofacial CT,,,,,,,,,,,,,,,,,,,,,,
375,376,Northridge Hospital Medical Center,34.220789,-118.533216,granted,18300 Roscoe Boulevard,,Northridge,CA,91328,USA,,,,echo,www.google.com/search?q=Northridge+Hospital+Medical+Center,Northridge Hospital Medical Center Northridge,,,"May 31, 2023",Adult Transthoracic,,,,,,,,,,,,,,,,,,,,
376,377,"Northstate Foot and Ankle Specialist, Inc.",39.722336,-121.797085,granted,1806 Foundation Lane,,Chico,CA,95928,USA,,,,mr,"www.google.com/search?q=Northstate+Foot+and+Ankle+Specialist,+Inc.","Northstate Foot and Ankle Specialist, Inc. Chico",,,,,"Jul 31, 2025",Musculoskeletal MRI,,,,,,,,,,,,,,,,,,
377,378,OC Veincare and Diagnostic Center,33.609267,-117.729276,granted,24331 El Toro Road,Suite 380,Laguna Woods,CA,92637,USA,,www.ocveincare.com,,vein_center,,OC Veincare and Diagnostic Center Laguna Woods,,,,,,,,,,,,,,,,,"Jul 31, 2023",Superficial Venous Evaluation and Management,,,,,,
378,379,OCEANN ENT,33.704471,-117.989074,granted,17742 Beach Blvd,Suite 345,Huntington Beach,CA,92647,USA,,"www,oceannent.com",,ct,,OCEANN ENT Huntington Beach,"Mar 31, 2024",Maxillofacial CT,,,,,,,,,,,,,,,,,,,,,,
379,380,"Omid Vahdat, MD",33.803172,-118.065737,granted,3801 Katella Ave,suite 310,Los Alamitos,CA,90720,USA,,,,echo,"www.google.com/search?q=Omid+Vahdat,+MD","Omid Vahdat, MD Los Alamitos",,,"May 31, 2025","Adult Stress, Adult Transthoracic",,,,,,,,,,,,,,,,,,,,
380,381,Optum Covina Main,34.078975,-117.896279,granted,420 West Rowland Street,,Covina,CA,91723,USA,,www.maganclinic.com,,echo,,Optum Covina Main Covina,,,"Apr 30, 2025","Adult Stress, Adult Transthoracic",,,,,,,,,,,,,,,,,,,,
381,382,Orange Coast Memorial Hospital,33.70166,-117.956192,granted,9920 Talbert Avenue,,Fountain Valley,CA,92708,USA,,www.memorialcare.org/orange-coast-memorial,,echo,,Orange Coast Memorial Hospital Fountain Valley,,,"Nov 30, 2024",Adult Transthoracic,,,,,,,,,,,,,,,,,,,,
382,383,Orange County Cardio Center,33.714161,-117.937005,granted,"17150 Euclid St, Ste 306",,Fountain Valley,CA,92708,USA,,,,nuclear,www.google.com/search?q=Orange+County+Cardio+Center,Orange County Cardio Center Fountain Valley,,,,,,,"Jul 31, 2025",Myocardial Perfusion Imaging,,,,,,,,,,,,,,,,
383,384,Orange County Heart Institute and Research Center,33.780331,-117.865203,granted,1140 West La Veta Avenue,Suite 640,Orange,CA,92868,USA,,www.ocheartinstitute.com,,nuclear,,Orange County Heart Institute and Research Center Orange,,,,,,,"Mar 31, 2023","Equilibrium Radionuclide Angiography, Myocardial Perfusion Imaging",,,,,,,,,,,,,,,,
384,385,Orange County Heart Institute and Research Center,33.786678,-117.878026,granted,1140 West LaVeta Avenue,Suite 640,Orange,CA,92868,USA,,ocheartinstitute.com,,echo,,Orange County Heart Institute and Research Center Orange,,,"Feb 28, 2023","Adult Stress, Adult Transthoracic",,,,,,,,,,,,,,,,,,,,
385,386,Orange County Heart Institute and Research Center,33.682958,-117.806795,granted,4050 Barranca Parkway 110,,Irvine,CA,92604,USA,,ocheartinstitute.com,,echo,,Orange County Heart Institute and Research Center Irvine,,,"Feb 28, 2023","Adult Stress, Adult Transthoracic",,,,,,,,,,,,,,,,,,,,
386,387,Orange County Vascular Specialists,33.630526,-117.929102,granted,520 Superior Avenue,Suite 370,Newport Beach,CA,92663,USA,,,,vascular,www.google.com/search?q=Orange+County+Vascular+Specialists,Orange County Vascular Specialists Newport Beach,,,,,,,,,"Sep 29, 2022",Extracranial Cerebrovascular Testing,,,,,,,,,,,,,,
387,388,Orthopaedic Specialists of North County,33.118555,-117.318403,granted,6121 Paseo del Norte Ste. 105,,Carlsbad,CA,92011,USA,,,,mr,www.google.com/search?q=Orthopaedic+Specialists+of+North+County,Orthopaedic Specialists of North County Carlsbad,,,,,"Jul 31, 2023",Musculoskeletal MRI,,,,,,,,,,,,,,,,,,
388,389,Orthopaedic Specialists of North County,33.18786,-117.292327,granted,3905 Waring Road,,Oceanside,CA,92056,USA,,orthonorthcounty.com,,mr,,Orthopaedic Specialists of North County Oceanside,,,,,"Jul 31, 2023",Musculoskeletal MRI,,,,,,,,,,,,,,,,,,
389,390,Orthopedic Associates of Northern California,39.716032,-121.789214,granted,131 Raley Boulevard,,Chico,CA,95928,USA,,www.oanc-chico.com,,mr,,Orthopedic Associates of Northern California Chico,,,,,"Oct 31, 2023",Musculoskeletal MRI,,,,,,,,,,,,,,,,,,
390,391,Orthopedic Associates of Northern California,39.716032,-121.789214,granted,131 Raley Blvd.,Suite 100,Chico,CA,95928,USA,,,,ct,www.google.com/search?q=Orthopedic+Associates+of+Northern+California,Orthopedic Associates of Northern California Chico,"Feb 28, 2025","Body CT, Neurological CT",,,,,,,,,,,,,,,,,,,,,,
391,392,Oshodi Medical Corporation,33.570415,-117.204663,granted,40770 California Oaks Rd.,#A,Murrieta,CA,92562,USA,,,,nuclear,www.google.com/search?q=Oshodi+Medical+Corporation,Oshodi Medical Corporation Murrieta,,,,,,,"May 31, 2023",Myocardial Perfusion Imaging,,,,,,,,,,,,,,,,
392,393,Oxnard Cardiovascular and Medical Group,34.195136,-119.189195,granted,921 West 7th Street,,Oxnard,CA,93030,,,,,nuclear,www.google.com/search?q=Oxnard+Cardiovascular+and+Medical+Group,Oxnard Cardiovascular and Medical Group Oxnard,,,,,,,"Sep 30, 2022",Positron Emission Tomography (PET),,,,,,,,,,,,,,,,
393,394,Pacific Cardiovascular Associates Medical Group,33.777123,-117.859601,granted,681 South Parker,Suite 100,Orange,CA,92868,USA,,pcacardiology.com,,nuclear,,Pacific Cardiovascular Associates Medical Group Orange,,,,,,,"Mar 31, 2023",Myocardial Perfusion Imaging,,,,,,,,,,,,,,,,
394,395,Pacific Cardiovascular Associates Medical Group Inc.,33.684509,-117.885514,granted,3070 Bristol Street,Suite 190,Costa Mesa,CA,92626,USA,,,,vascular,www.google.com/search?q=Pacific+Cardiovascular+Associates+Medical+Group+Inc.,Pacific Cardiovascular Associates Medical Group Inc. Costa Mesa,,,,,,,,,"Aug 31, 2023","Extracranial Cerebrovascular Testing, Peripheral Venous Testing",,,,,,,,,,,,,,
395,396,"Pacific Cardiovascular Associates Medical Group, Inc.",33.847138,-117.934192,granted,710 N. Euclid Street,Suite 214,Anaheim,CA,92801,USA,,,,echo,"www.google.com/search?q=Pacific+Cardiovascular+Associates+Medical+Group,+Inc.","Pacific Cardiovascular Associates Medical Group, Inc. Anaheim",,,"Jun 30, 2024",Adult Transthoracic,,,,,,,,,,,,,,,,,,,,
396,397,"Pacific Cardiovascular Associates Medical Group, Inc.",33.847138,-117.934192,granted,710 North Euclid Street,Suite 214,Anaheim,CA,92801,USA,,,,vascular,"www.google.com/search?q=Pacific+Cardiovascular+Associates+Medical+Group,+Inc.","Pacific Cardiovascular Associates Medical Group, Inc. Anaheim",,,,,,,,,"Aug 31, 2023","Extracranial Cerebrovascular Testing, Peripheral Arterial Testing, Peripheral Venous Testing",,,,,,,,,,,,,,
397,398,"Pacific Cardiovascular Associates Medical Group, Inc.",33.68448,-117.88439,granted,3070 Bristol Street,Suite 190,Costa Mesa,CA,92626,USA,,,,echo,"www.google.com/search?q=Pacific+Cardiovascular+Associates+Medical+Group,+Inc.","Pacific Cardiovascular Associates Medical Group, Inc. Costa Mesa",,,"Jun 30, 2024",Adult Transthoracic,,,,,,,,,,,,,,,,,,,,
398,399,"Pacific Cardiovascular Associates Medical Group, Inc.",33.777559,-117.859609,granted,681 S. Parker Street,Suite 100,Orange,CA,92868,USA,,,,echo,"www.google.com/search?q=Pacific+Cardiovascular+Associates+Medical+Group,+Inc.","Pacific Cardiovascular Associates Medical Group, Inc. Orange",,,"Jun 30, 2024",Adult Transthoracic,,,,,,,,,,,,,,,,,,,,
399,400,"Pacific Cardiovascular Associates Medical Group, Inc.",33.61049,-117.711085,granted,24022 Calle De La Plata,Suite 500,Laguna Hills,CA,92653,USA,,,,echo,"www.google.com/search?q=Pacific+Cardiovascular+Associates+Medical+Group,+Inc.","Pacific Cardiovascular Associates Medical Group, Inc. Laguna Hills",,,"Jun 30, 2024",Adult Transthoracic,,,,,,,,,,,,,,,,,,,,
400,401,"Pacific Cardiovascular Associates Medical Group, Inc.",33.61015,-117.711563,granted,24022 Calle De La Plata,Suite 500,Laguna Hills,CA,92653,USA,,,,vascular,"www.google.com/search?q=Pacific+Cardiovascular+Associates+Medical+Group,+Inc.","Pacific Cardiovascular Associates Medical Group, Inc. Laguna Hills",,,,,,,,,"Aug 31, 2023","Extracranial Cerebrovascular Testing, Peripheral Arterial Testing, Peripheral Venous Testing",,,,,,,,,,,,,,
