,id,name,lat,lng,category,address,address2,city,state,postal,country,phone,web,features,modalities,searchGoogle,search,ct,ct_areas,echo,echo_areas,mr,mr_areas,nuclear,nuclear_areas,vascular,vascular_areas,pediatric_echo,pediatric_echo_areas,ct-dental,ct-dental_areas,stenting,stenting_areas,vein_center,vein_center_areas,cardiac_electrophysiology,cardiac_electrophysiology_areas,cardiovascular_catheterization,cardiovascular_catheterization_areas,jrcdms,jrcdms_areas
481,482,Salinas Valley Memorial Hospital,36.659979,-121.646327,granted,450 East Romie Lane,,Salinas,CA,93901,USA,,www.svmh.com,,echo,,Salinas Valley Memorial Hospital Salinas,,,"Jun 30, 2025",Adult Transthoracic,,,,,,,,,,,,,,,,,,,,
482,483,"Saman Fakheri, MD, Inc.",34.257533,-118.504702,granted,17075 Devonshire St 201,,Northridge,CA,91325,,,,,nuclear,"www.google.com/search?q=Saman+Fakheri,+MD,+Inc.","Saman Fakheri, MD, Inc. Northridge",,,,,,,"Sep 30, 2022",Positron Emission Tomography (PET),,,,,,,,,,,,,,,,
483,484,San Diego Arthritis Medical Clinic,32.777974,-117.11661,granted,3633 Camino Del Rio S.,#300,San Diego,CA,92108,USA,,www.sdamc.com,,mr,,San Diego Arthritis Medical Clinic San Diego,,,,,"May 31, 2025",Musculoskeletal MRI,,,,,,,,,,,,,,,,,,
484,485,San Diego Cardiac Center,32.802101,-117.151727,granted,3131 Berger Avenue,Suite 200,San Diego,CA,92123,USA,,sdcardiac.com,,echo,,San Diego Cardiac Center San Diego,,,"Nov 30, 2023","Adult Stress, Adult Transthoracic",,,,,,,,,,,,,,,,,,,,
485,486,"San Diego Cardiovascular Associates, Inc-1",33.036307,-117.285865,granted,"320 Santa Fe Dr, Ste 204",,Encinitas,CA,92024,USA,,www.sdcva.com,,nuclear,,"San Diego Cardiovascular Associates, Inc-1 Encinitas",,,,,,,"Dec 31, 2023",Myocardial Perfusion Imaging,,,,,,,,,,,,,,,,
486,487,"San Diego Cardiovascular Associates, Inc-2.",32.886633,-117.225269,granted,9850 Genesee Avenue,Suite #780,La Jolla,CA,92037,USA,,sdcva.com,,nuclear,,"San Diego Cardiovascular Associates, Inc-2. La Jolla",,,,,,,"Dec 31, 2023",Myocardial Perfusion Imaging,,,,,,,,,,,,,,,,
487,488,"San Diego Ear, Nose and Throat Specialists",33.114077,-117.270515,granted,2020 Cassia Rd 101,,Carlsbad,CA,92009,USA,,www.sdents.com,,ct,,"San Diego Ear, Nose and Throat Specialists Carlsbad","Jun 30, 2024",Maxillofacial CT,,,,,,,,,,,,,,,,,,,,,,
488,489,San Diego Vascular Center,33.091786,-117.078928,granted,625 W. Citracado Parkway,,Escondido,CA,92025,USA,,sdvascularcenter.com,,vascular,,San Diego Vascular Center Escondido,,,,,,,,,"Jul 31, 2023","Extracranial Cerebrovascular Testing, Peripheral Arterial Testing, Peripheral Venous Testing",,,,,,,,,,,,,,
489,490,San Francisco Otolaryngology Medical Group,37.789331,-122.407788,granted,450 Sutter Street,Suite 933,San Francisco,CA,94108,USA,,,,ct,www.google.com/search?q=San+Francisco+Otolaryngology+Medical+Group,San Francisco Otolaryngology Medical Group San Francisco,"May 31, 2025",Maxillofacial CT,,,,,,,,,,,,,,,,,,,,,,
490,491,San Joaquin Cardiology Medical Group,37.978145,-121.292114,granted,2800 N. California Suite 14,,Stockton,CA,95204,USA,,,,nuclear,www.google.com/search?q=San+Joaquin+Cardiology+Medical+Group,San Joaquin Cardiology Medical Group Stockton,,,,,,,"Jul 31, 2024","Myocardial Perfusion Imaging, Positron Emission Tomography (PET)",,,,,,,,,,,,,,,,
491,492,San Jose Medical Center,37.240014,-121.799382,granted,250 International Circle,,San Jose,CA,95119,USA,,kp.org,,echo,,San Jose Medical Center San Jose,,,"Mar 31, 2024",Adult Transthoracic,,,,,,,,,,,,,,,,,,,,
492,493,"San Leandro Campus, Alameda Health System",37.714632,-122.141973,granted,13855 E 14th Street,,San Leandro,CA,94578,USA,,,,echo,"www.google.com/search?q=San+Leandro+Campus,+Alameda+Health+System","San Leandro Campus, Alameda Health System San Leandro",,,"Jan 31, 2024",Adult Transthoracic,,,,,,,,,,,,,,,,,,,,
493,494,San Mateo Podiatry Group,37.593915,-122.382006,granted,"1750 El Camino Real, Suite 106",,Burlingame,CA,94010,USA,,www.sanmateopodiatrygroup.com,,ct,,San Mateo Podiatry Group Burlingame,"Aug 31, 2023",Body CT,,,,,,,,,,,,,,,,,,,,,,
494,495,"Sanjiv Goel, MD  Thousand Oaks - Nuclear Cardiology Laboratory",34.207407,-118.885499,granted,2100 Lynn Rd.,Suite 205,Thousand Oaks,CA,91360,USA,,www.drgoel.com,,nuclear,,"Sanjiv Goel, MD  Thousand Oaks - Nuclear Cardiology Laboratory Thousand Oaks",,,,,,,"Nov 30, 2023",Myocardial Perfusion Imaging,,,,,,,,,,,,,,,,
495,496,Sansum Clinic Echocardiography Laboratory,34.429921,-119.722615,granted,317 West Pueblo Street,,Santa Barbara,CA,93105,USA,,,,echo,www.google.com/search?q=Sansum+Clinic+Echocardiography+Laboratory,Sansum Clinic Echocardiography Laboratory Santa Barbara,,,"May 31, 2024","Adult Stress, Adult Transthoracic",,,,,,,,,,,,,,,,,,,,
496,497,"Santa Barbara Cardiovascular Medical Group, Inc.",34.431636,-119.723433,granted,"2400 Bath Street, Suite 201",,Santa Barbara,CA,93105,USA,,,,echo,"www.google.com/search?q=Santa+Barbara+Cardiovascular+Medical+Group,+Inc.","Santa Barbara Cardiovascular Medical Group, Inc. Santa Barbara",,,"Sep 30, 2023","Adult Stress, Adult Transthoracic",,,,,,,,,,,,,,,,,,,,
497,498,Santa Barbara Cottage Hospital,34.42936,-119.72321,granted,300 West Pueblo Street,,Santa Barbara,CA,93105,USA,,www.ccsb.org,,nuclear,,Santa Barbara Cottage Hospital Santa Barbara,,,,,,,"Apr 30, 2023","General Nuclear Medicine, Myocardial Perfusion Imaging, Positron Emission Tomography (PET)",,,,,,,,,,,,,,,,
498,499,Santa Barbara Cottage Hospital,34.429483,-119.723077,granted,400 West Pueblo Street,,Santa Barbara,CA,93105,USA,,,,vascular,www.google.com/search?q=Santa+Barbara+Cottage+Hospital,Santa Barbara Cottage Hospital Santa Barbara,,,,,,,,,"Dec 31, 2023",Intracranial Cerebrovascular Testing,,,,,,,,,,,,,,
499,500,Santa Cruz ENT,36.9803,-122.018983,granted,550 Water St,Ste A,Santa Cruz,CA,95060,USA,,scentmd.com,,ct,,Santa Cruz ENT Santa Cruz,"Sep 30, 2024",Maxillofacial CT,,,,,,,,,,,,,,,,,,,,,,
500,501,Santa Monica UCLA Medical Center,34.027776,-118.486315,granted,1250 Sixteenth Street,,Santa Monica,CA,90404,USA,,,,echo,www.google.com/search?q=Santa+Monica+UCLA+Medical+Center,Santa Monica UCLA Medical Center Santa Monica,,,"Jan 29, 2023",Adult Transthoracic,,,,,,,,,,,,,,,,,,,,
501,502,Santa Monica UCLA Medical Center,34.027776,-118.486315,granted,1250 16th Street,,Santa Monica,CA,90404,USA,,,,vascular,www.google.com/search?q=Santa+Monica+UCLA+Medical+Center,Santa Monica UCLA Medical Center Santa Monica,,,,,,,,,"Dec 31, 2023","Extracranial Cerebrovascular Testing, Peripheral Arterial Testing, Peripheral Venous Testing",,,,,,,,,,,,,,
502,503,Sarsam Cardiology,33.710842,-117.189958,granted,26960 Cherry Hills Blvd.,Ste. C,Menifee,CA,92586,,,,,nuclear,www.google.com/search?q=Sarsam+Cardiology,Sarsam Cardiology Menifee,,,,,,,"May 31, 2023",Myocardial Perfusion Imaging,,,,,,,,,,,,,,,,
503,504,Scripps Clinic Anderson Medical Pavillion and La Jolla Memorial Hospital,32.885077,-117.22272,granted,9898 Genesee Avenue,,La Jolla,CA,92037,USA,,NA,,echo,,Scripps Clinic Anderson Medical Pavillion and La Jolla Memorial Hospital La Jolla,,,"Mar 31, 2025","Adult Stress, Adult Transesophageal, Adult Transthoracic",,,,,,,,,,,,,,,,,,,,
504,505,Scripps Clinic Carmel Valley,32.937648,-117.232171,granted,3811 Valley Centre Drive,,San Diego,CA,92130,USA,,scrippsnet/,,echo,,Scripps Clinic Carmel Valley San Diego,,,"Mar 31, 2025","Adult Stress, Adult Transthoracic",,,,,,,,,,,,,,,,,,,,
505,506,Scripps Clinic Carmel Valley Vascular Laboratory,32.937648,-117.232171,granted,3811 Valley Center Dr.,,San Diego,CA,92130,USA,,,,vascular,www.google.com/search?q=Scripps+Clinic+Carmel+Valley+Vascular+Laboratory,Scripps Clinic Carmel Valley Vascular Laboratory San Diego,,,,,,,,,"Aug 31, 2025",Extracranial Cerebrovascular Testing,,,,,,,,,,,,,,
506,507,Scripps Clinic Encinitas,33.036307,-117.285865,granted,326 Santa Fe Drive,,Encinitas,CA,92024,USA,,scrippsnet/,,echo,,Scripps Clinic Encinitas Encinitas,,,"Mar 31, 2025","Adult Stress, Adult Transthoracic",,,,,,,,,,,,,,,,,,,,
507,508,Scripps Clinic Encinitas Vascular Laboratory,33.036307,-117.285865,granted,326 Sante Fe Dr.,,Encinitas,CA,92024,USA,,,,vascular,www.google.com/search?q=Scripps+Clinic+Encinitas+Vascular+Laboratory,Scripps Clinic Encinitas Vascular Laboratory Encinitas,,,,,,,,,"Aug 31, 2025",Extracranial Cerebrovascular Testing,,,,,,,,,,,,,,
508,509,Scripps Clinic Green Hospital Vascular Laboratory,32.895992,-117.24161,granted,10666 N. Torrey Pines Road,,La Jolla,CA,92037,USA,,,,vascular,www.google.com/search?q=Scripps+Clinic+Green+Hospital+Vascular+Laboratory,Scripps Clinic Green Hospital Vascular Laboratory La Jolla,,,,,,,,,"Aug 31, 2025",Extracranial Cerebrovascular Testing,,,,,,,,,,,,,,
509,510,Scripps Clinic Integrative Medicine,32.896621,-117.241746,granted,10820 North Torry Pines Road,,La Jolla,CA,93027,USA,,,,echo,www.google.com/search?q=Scripps+Clinic+Integrative+Medicine,Scripps Clinic Integrative Medicine La Jolla,,,"Mar 31, 2025",Adult Transthoracic,,,,,,,,,,,,,,,,,,,,
510,511,Scripps Clinic Jefferson,33.183219,-117.33633,granted,2205 Vista Way,,Oceanside,CA,92054,USA,,,,echo,www.google.com/search?q=Scripps+Clinic+Jefferson,Scripps Clinic Jefferson Oceanside,,,"Mar 31, 2025","Adult Stress, Adult Transthoracic",,,,,,,,,,,,,,,,,,,,
511,512,Scripps Clinic La Jolla Vascular Laboratory,32.885077,-117.22272,granted,9898 Genesee Ave,,La Jolla,CA,92037,USA,,,,vascular,www.google.com/search?q=Scripps+Clinic+La+Jolla+Vascular+Laboratory,Scripps Clinic La Jolla Vascular Laboratory La Jolla,,,,,,,,,"Aug 31, 2025",Extracranial Cerebrovascular Testing,,,,,,,,,,,,,,
512,513,Scripps Clinic Mission Valley,32.777487,-117.160774,granted,7425 Mission Valley Rd,Echo Lab,San Diego,CA,92108,USA,,,,echo,www.google.com/search?q=Scripps+Clinic+Mission+Valley,Scripps Clinic Mission Valley San Diego,,,"Mar 31, 2025",Adult Transthoracic,,,,,,,,,,,,,,,,,,,,
513,514,Scripps Clinic Rancho Bernardo,32.989863,-117.076602,granted,15025 Innovation Drive,,San Diego,CA,92128,USA,,scrippsnet/,,echo,,Scripps Clinic Rancho Bernardo San Diego,,,"Mar 31, 2025","Adult Stress, Adult Transthoracic",,,,,,,,,,,,,,,,,,,,
514,515,Scripps Clinic Rancho Bernardo Vascular Laboratory,32.989098,-117.076992,granted,15004 Innovation Dr.,,San Diego,CA,92128,USA,,,,vascular,www.google.com/search?q=Scripps+Clinic+Rancho+Bernardo+Vascular+Laboratory,Scripps Clinic Rancho Bernardo Vascular Laboratory San Diego,,,,,,,,,"Aug 31, 2025",Extracranial Cerebrovascular Testing,,,,,,,,,,,,,,
515,516,Scripps Clinic Rancho San Diego,32.748159,-116.960279,granted,10862 Calle Verde,,La Mesa,CA,91941,USA,,,,echo,www.google.com/search?q=Scripps+Clinic+Rancho+San+Diego,Scripps Clinic Rancho San Diego La Mesa,,,"Mar 31, 2025",Adult Transthoracic,,,,,,,,,,,,,,,,,,,,
516,517,Scripps Clinic Torrey Pines and Green Hospital,32.895992,-117.24161,granted,10666 North Torrey Pines Road,Mail Drop SW206,La Jolla,CA,92037,USA,,na,,echo,,Scripps Clinic Torrey Pines and Green Hospital La Jolla,,,"Mar 31, 2025","Adult Transesophageal, Adult Transthoracic",,,,,,,,,,,,,,,,,,,,
517,518,Seip Orthopedic Surgery Ll Pc,34.124538,-116.411349,granted,57402 29 Palms Hwy Ste 5,,Yucca Valley,CA,92284,USA,,,,ct,www.google.com/search?q=Seip+Orthopedic+Surgery+Ll+Pc,Seip Orthopedic Surgery Ll Pc Yucca Valley,"Aug 31, 2024",Body CT,,,,,,,,,,,,,,,,,,,,,,
518,519,"Senta Imaging, LLC",32.778867,-117.116945,granted,3590 Camino Del Rio North Suite 103,,San Diego,CA,92108,USA,,,,ct,"www.google.com/search?q=Senta+Imaging,+LLC","Senta Imaging, LLC San Diego","Jun 30, 2024",Maxillofacial CT,,,,,,,,,,,,,,,,,,,,,,
519,520,"Sepideh Kazemi, MD, Inc.",33.661217,-117.774207,granted,"16300 Sand Canyon Ave., Suite 601",,Irvine,CA,92618,USA,,,,nuclear,"www.google.com/search?q=Sepideh+Kazemi,+MD,+Inc.","Sepideh Kazemi, MD, Inc. Irvine",,,,,,,"May 31, 2023",Myocardial Perfusion Imaging,,,,,,,,,,,,,,,,
520,521,Sequoia Hospital,37.453803,-122.237427,granted,170 Alameda de las Pulgas,,Redwood City,CA,94062,USA,,,,echo,www.google.com/search?q=Sequoia+Hospital,Sequoia Hospital Redwood City,,,"Mar 31, 2024",Adult Transthoracic,,,,,,,,,,,,,,,,,,,,
521,522,Sequoia Hospital,37.480987,-122.253223,granted,170 Alameda De Las Pulgas,,Redwood City,CA,94062,USA,,www.dignityhealth.org/bayarea/locations/sequoia,,vascular,,Sequoia Hospital Redwood City,,,,,,,,,"Jun 30, 2024","Extracranial Cerebrovascular Testing, Peripheral Arterial Testing, Peripheral Venous Testing",,,,,,,,,,,,,,
522,523,"Serap Sobnosky, M.D.",33.780234,-118.185048,granted,"1045 Atlantic Ave., Ste 611",,Long Beach,CA,90813,USA,,,,nuclear,"www.google.com/search?q=Serap+Sobnosky,+M.D.","Serap Sobnosky, M.D. Long Beach",,,,,,,"Jul 31, 2025",Myocardial Perfusion Imaging,,,,,,,,,,,,,,,,
523,524,Serra Community Medical Clinic,34.23916,-118.393598,granted,9375 San Fernando Rd.,,Sun Valley,CA,91352,USA,,,,ct,www.google.com/search?q=Serra+Community+Medical+Clinic,Serra Community Medical Clinic Sun Valley,"Feb 28, 2025","Body CT, Neurological CT, Maxillofacial CT",,,,,,,,,,,,,,,,,,,,,,
524,525,SGMF Cardiology Stockton,38.003451,-121.28547,granted,1801 East March Lane,Suite A-170,Stockton,CA,95210,USA,,,,echo,www.google.com/search?q=SGMF+Cardiology+Stockton,SGMF Cardiology Stockton Stockton,,,"Aug 31, 2024","Adult Stress, Adult Transthoracic",,,,,,,,,,,,,,,,,,,,
525,526,"Shahid K. Siddiqui, M.D., Inc.",37.361148,-121.850555,granted,200 Jose Figueres Avenue,Suite 365,San Jose,CA,95116,USA,,,,nuclear,"www.google.com/search?q=Shahid+K.+Siddiqui,+M.D.,+Inc.","Shahid K. Siddiqui, M.D., Inc. San Jose",,,,,,,"Aug 31, 2023",Myocardial Perfusion Imaging,,,,,,,,,,,,,,,,
526,527,Sharp Grossmont Hospital,32.779435,-117.009178,granted,5555 Grossmont Center Drive,,La Mesa,CA,91942,USA,,www.sharp.com,,vascular,,Sharp Grossmont Hospital La Mesa,,,,,,,,,"May 31, 2025","Extracranial Cerebrovascular Testing, Peripheral Arterial Testing, Peripheral Venous Testing",,,,,,,,,,,,,,
527,528,Sharp Grossmont Hospital Heart and Vascular Center,32.779435,-117.009178,granted,5555 Grossmont Center Drive,,La Mesa,CA,91942,USA,,,,echo,www.google.com/search?q=Sharp+Grossmont+Hospital+Heart+and+Vascular+Center,Sharp Grossmont Hospital Heart and Vascular Center La Mesa,,,"Jul 31, 2023",Adult Transthoracic,,,,,,,,,,,,,,,,,,,,
528,529,Sharp Memorial Hospital,32.800255,-117.154133,granted,7901 Frost Street,,San Diego,CA,92123,USA,,,,echo,www.google.com/search?q=Sharp+Memorial+Hospital,Sharp Memorial Hospital San Diego,,,"Apr 30, 2023","Adult Stress, Adult Transesophageal, Adult Transthoracic",,,,,,,,,,,,,,,,,,,,
529,530,Sharp Rees-Stealy Medical Group,32.799175,-117.155883,multigranted,2929 Health Center Drive,,San Diego,CA,92123,USA,,www.sharp.com,,"nuclear, echo",,Sharp Rees-Stealy Medical Group San Diego,,,"Jan 29, 2023","Adult Stress, Adult Transthoracic",,,"Oct 31, 2022",Myocardial Perfusion Imaging,,,,,,,,,,,,,,,,
530,531,Shasta Regional Medical Center,40.585273,-122.38685,granted,1100 Butte Street,,Redding,CA,96001,USA,,,,vascular,www.google.com/search?q=Shasta+Regional+Medical+Center,Shasta Regional Medical Center Redding,,,,,,,,,"Dec 30, 2022","Extracranial Cerebrovascular Testing, Peripheral Arterial Testing, Peripheral Venous Testing",,,,,,,,,,,,,,
531,532,"Shawn S. Nasseri, MD, Inc.",34.068554,-118.405686,granted,435 North Bedford Drive,Suite 308,Beverly Hills,CA,90210,USA,,,,ct,"www.google.com/search?q=Shawn+S.+Nasseri,+MD,+Inc.","Shawn S. Nasseri, MD, Inc. Beverly Hills","Dec 31, 2023",Maxillofacial CT,,,,,,,,,,,,,,,,,,,,,,
532,533,"Sherev Heart and Vascular Clinic, Inc.",32.781877,-117.007587,granted,8851 Center Dr. 304,,La Mesa,CA,91942,,,,,nuclear,"www.google.com/search?q=Sherev+Heart+and+Vascular+Clinic,+Inc.","Sherev Heart and Vascular Clinic, Inc. La Mesa",,,,,,,"May 31, 2023",Myocardial Perfusion Imaging,,,,,,,,,,,,,,,,
533,534,SHERMAN OAKS MEDICAL CENTER,34.158677,-118.448703,granted,4835 VAN NUYS BLVD SUITE  215,,SHERMAN OAKS,CA,91403,USA,,,,echo,www.google.com/search?q=SHERMAN+OAKS+MEDICAL+CENTER,SHERMAN OAKS MEDICAL CENTER SHERMAN OAKS,,,"Apr 30, 2025","Adult Stress, Adult Transthoracic",,,,,,,,,,,,,,,,,,,,
534,535,Sierra Nevada Memorial Hospital,39.228961,-121.047276,granted,155 Glasson Way,,Grass Valley,CA,95945,USA,,,,echo,www.google.com/search?q=Sierra+Nevada+Memorial+Hospital,Sierra Nevada Memorial Hospital Grass Valley,,,"Mar 31, 2023","Adult Stress, Adult Transthoracic",,,,,,,,,,,,,,,,,,,,
535,536,Sierra Pacific Orthopedics part of Community Foundation Medical Group,36.837535,-119.758498,granted,1630 E. Herndon Ave,,Fresno,CA,93720,USA,,,,ct,www.google.com/search?q=Sierra+Pacific+Orthopedics+part+of+Community+Foundation+Medical+Group,Sierra Pacific Orthopedics part of Community Foundation Medical Group Fresno,"Nov 29, 2022",Body CT,,,,,,,,,,,,,,,,,,,,,,
536,537,Sierra Sinus Center and ENT,39.228326,-121.045482,granted,123 Margaret Ln Ste C1,,Grass Valley,CA,95945,USA,,,,ct,www.google.com/search?q=Sierra+Sinus+Center+and+ENT,Sierra Sinus Center and ENT Grass Valley,"Jul 31, 2025",Maxillofacial CT,,,,,,,,,,,,,,,,,,,,,,
537,538,"Silicon Valley Cardiology Palo Alto Medical Foundation for Healthcare, Research,",37.45834,-122.141322,granted,1950 University Avenue,Suite 160,East Palo Alto,CA,94303,USA,,siliconvalleycardiology.com,,nuclear,,"Silicon Valley Cardiology Palo Alto Medical Foundation for Healthcare, Research, East Palo Alto",,,,,,,"Dec 31, 2024","Myocardial Perfusion Imaging, Positron Emission Tomography (PET)",,,,,,,,,,,,,,,,
538,539,"Smyth Drive Imaging, LLC",34.58715,-118.141724,granted,655 West Avenue Q,,Palmdale,CA,93551,USA,,,,ct,"www.google.com/search?q=Smyth+Drive+Imaging,+LLC","Smyth Drive Imaging, LLC Palmdale","May 31, 2024",Maxillofacial CT,,,,,,,,,,,,,,,,,,,,,,
539,540,"SmythDrive Imaging, LLC",34.441338,-118.56745,granted,27879 Smyth Drive,,Valencia,CA,91355,USA,,,,ct,"www.google.com/search?q=SmythDrive+Imaging,+LLC","SmythDrive Imaging, LLC Valencia","May 31, 2024",Maxillofacial CT,,,,,,,,,,,,,,,,,,,,,,
540,541,SoCal Breathe Free Sinus and Allergy Centers,34.160011,-118.328992,granted,201 S Buena Vista St,STE 300,Burbank,CA,91505,USA,,www.socalbreathefree.com/,,ct,,SoCal Breathe Free Sinus and Allergy Centers Burbank,"May 31, 2025",Maxillofacial CT,,,,,,,,,,,,,,,,,,,,,,
541,542,SoCal Radiology,33.937918,-117.292281,granted,6276 River Crest Dr.,Suite D,Riverside,CA,92507,USA,,,,mr,www.google.com/search?q=SoCal+Radiology,SoCal Radiology Riverside,,,,,"Sep 30, 2022","Musculoskeletal MRI, Neurological MRI",,,,,,,,,,,,,,,,,,
542,543,"Sood Kisra, MD, PC",34.131574,-117.318221,granted,1800 Western Ave,#302,San Bernardino,CA,92411,,,,,nuclear,"www.google.com/search?q=Sood+Kisra,+MD,+PC","Sood Kisra, MD, PC San Bernardino",,,,,,,"May 31, 2023",Myocardial Perfusion Imaging,,,,,,,,,,,,,,,,
543,544,South Bay Heart and Vascular Laboratory,33.837571,-118.346783,granted,3475 Torrance Boulevard,Suite A,Torrance,CA,90503,USA,,,,echo,www.google.com/search?q=South+Bay+Heart+and+Vascular+Laboratory,South Bay Heart and Vascular Laboratory Torrance,,,"Jul 31, 2024","Adult Stress, Adult Transthoracic",,,,,,,,,,,,,,,,,,,,
544,545,South Orange County Cardiology Group,33.608019,-117.708209,granted,24411 Health Center Dr. Suite 550,,Laguna Hills,CA,92653,USA,,,,nuclear,www.google.com/search?q=South+Orange+County+Cardiology+Group,South Orange County Cardiology Group Laguna Hills,,,,,,,"Oct 31, 2023",Myocardial Perfusion Imaging,,,,,,,,,,,,,,,,
545,546,South Orange County Cardiology Group,33.608019,-117.708209,granted,24411 Health Center Drive,Suite 550,Laguna Hills,CA,92653,USA,,,,echo,www.google.com/search?q=South+Orange+County+Cardiology+Group,South Orange County Cardiology Group Laguna Hills,,,"Sep 30, 2024","Adult Stress, Adult Transthoracic",,,,,,,,,,,,,,,,,,,,
546,547,Southern California ENT,33.804544,-118.067976,granted,10861 Cherry St UNIT 303,,Los Alamitos,CA,90720,USA,,www.socalearnosethroat.com,,ct,,Southern California ENT Los Alamitos,"May 31, 2025",Maxillofacial CT,,,,,,,,,,,,,,,,,,,,,,
547,548,Southern California ENT and Allergy Associates,34.136549,-118.257856,granted,800 S Central Ave,Suite 101B,Glendale,CA,91204,United States,,www.entdoctorslosangeles.com,,ct,,Southern California ENT and Allergy Associates Glendale,"Nov 30, 2024",Maxillofacial CT,,,,,,,,,,,,,,,,,,,,,,
548,549,Southern California Heart Centers,34.07935,-118.107038,granted,506 West Valley Boulevard,Suite 100,San Gabriel,CA,91776,USA,,,,echo,www.google.com/search?q=Southern+California+Heart+Centers,Southern California Heart Centers San Gabriel,,,"Aug 31, 2024","Adult Stress, Adult Transthoracic",,,,,,,,,,,,,,,,,,,,
549,550,Southern California Heart Specialists,34.135776,-118.149214,granted,55 E. California Blvd,3rd Floor,Pasadena,CA,91105,USA,,www.socalheart.com,,nuclear,,Southern California Heart Specialists Pasadena,,,,,,,"Dec 31, 2023",Myocardial Perfusion Imaging,,,,,,,,,,,,,,,,
550,551,Southern California Medical Imaging and Open MRI,34.205604,-118.216187,granted,1809 Verdugo Blvd Suite 100,,Glendale,CA,91208,USA,,www.socalimagingopenmri.com,,mr,,Southern California Medical Imaging and Open MRI Glendale,,,,,"Oct 31, 2023","Musculoskeletal MRI, Neurological MRI",,,,,,,,,,,,,,,,,,
551,552,Southern California Multi Specialty Center,34.17615,-118.466179,granted,5805 Sepulveda Blvd.,Suite 690,Sherman Oaks,CA,91411,USA,,www.dreghbalieh.com/,,vascular,,Southern California Multi Specialty Center Sherman Oaks,,,,,,,,,"May 31, 2024","Extracranial Cerebrovascular Testing, Peripheral Arterial Testing, Peripheral Venous Testing",,,,,,,,,,,,,,
552,553,Southern California Orthopedic Institute,34.431698,-118.558203,granted,24051 Newhall Ranch Road,Building C,Valencia,CA,91354,USA,,,,mr,www.google.com/search?q=Southern+California+Orthopedic+Institute,Southern California Orthopedic Institute Valencia,,,,,"May 31, 2024",Musculoskeletal MRI,,,,,,,,,,,,,,,,,,
553,554,Southern California Orthopedic Institute,35.374865,-119.045596,granted,2400 Bahamas Drive,,Bakersfield,CA,93309,USA,,,,mr,www.google.com/search?q=Southern+California+Orthopedic+Institute,Southern California Orthopedic Institute Bakersfield,,,,,"May 31, 2024",Musculoskeletal MRI,,,,,,,,,,,,,,,,,,
554,555,Southern California Orthopedic Institute,34.174303,-118.870502,granted,375 Rolling Oaks Drive,Suite 210,Thousand Oaks,CA,91361,USA,,,,mr,www.google.com/search?q=Southern+California+Orthopedic+Institute,Southern California Orthopedic Institute Thousand Oaks,,,,,"May 31, 2024",Musculoskeletal MRI,,,,,,,,,,,,,,,,,,
555,556,Southern California Orthopedic Institute,34.194397,-118.461828,multigranted,6815 Noble Avenue,,Van Nuys,CA,91405,USA,,,,"mr, ct",www.google.com/search?q=Southern+California+Orthopedic+Institute,Southern California Orthopedic Institute Van Nuys,"Apr 30, 2025",Body CT,,,"May 31, 2024",Musculoskeletal MRI,,,,,,,,,,,,,,,,,,
556,557,Spine and Sports Specialties Medical Group,33.786678,-117.878026,multigranted,1120 West LaVita Ave.,Suite 320,Orange,CA,92868,USA,,,,"ct, mr",www.google.com/search?q=Spine+and+Sports+Specialties+Medical+Group,Spine and Sports Specialties Medical Group Orange,"Sep 30, 2022","Body CT, Neurological CT",,,"Jun 30, 2025","Musculoskeletal MRI, Neurological MRI",,,,,,,,,,,,,,,,,,
557,558,Sports and Spine MRI,33.812624,-118.351021,granted,23456 Hawthorne Blvd.,200,Torrance,CA,90505,USA,,,,mr,www.google.com/search?q=Sports+and+Spine+MRI,Sports and Spine MRI Torrance,,,,,"Dec 31, 2022",Musculoskeletal MRI,,,,,,,,,,,,,,,,,,
558,559,Spruce Multispecialty Group,36.842,-119.760457,granted,"1275 East Spruce, Suite 101",,Fresno,CA,93720,USA,,,,nuclear,www.google.com/search?q=Spruce+Multispecialty+Group,Spruce Multispecialty Group Fresno,,,,,,,"Jun 30, 2024",Myocardial Perfusion Imaging,,,,,,,,,,,,,,,,
559,560,St Charles Imaging Center,34.1856,-118.878102,granted,558 St Charles Dr. Ste 111,,Thousand Oaks,CA,91360,USA,,www.stcharlesimaging.com,,mr,,St Charles Imaging Center Thousand Oaks,,,,,"Jun 30, 2025","Body MRI, Musculoskeletal MRI, Neurological MRI",,,,,,,,,,,,,,,,,,
560,561,St Jude Medical Center,33.893503,-117.927952,granted,101 East Valencia Mesa Drive,,Fullerton,CA,92835,USA,,,,echo,www.google.com/search?q=St+Jude+Medical+Center,St Jude Medical Center Fullerton,,,"May 31, 2023",Adult Transthoracic,,,,,,,,,,,,,,,,,,,,
561,562,St. Agnes Medical Foundation,36.836995,-119.763753,granted,1105 E. Spruce Ave.,Ste. 203,Fresno,CA,93720,USA,,,,nuclear,www.google.com/search?q=St.+Agnes+Medical+Foundation,St. Agnes Medical Foundation Fresno,,,,,,,"Jun 30, 2024",Myocardial Perfusion Imaging,,,,,,,,,,,,,,,,
562,563,St. Joseph Heritage Medical Group Cardiology,33.780331,-117.865203,granted,1140 West La Veta Avenue,Suite 430,Orange,CA,92868,USA,,,,echo,www.google.com/search?q=St.+Joseph+Heritage+Medical+Group+Cardiology,St. Joseph Heritage Medical Group Cardiology Orange,,,"Oct 30, 2022","Adult Stress, Adult Transthoracic",,,,,,,,,,,,,,,,,,,,
563,564,St. Joseph Hospital,33.782399,-117.866093,granted,1100 West Stewart Drive,,Orange,CA,92868,USA,,,,echo,www.google.com/search?q=St.+Joseph+Hospital,St. Joseph Hospital Orange,,,"Feb 28, 2025","Adult Transesophageal, Adult Transthoracic",,,,,,,,,,,,,,,,,,,,
564,565,St. Joseph Hospital of Orange Vascular Lab,33.782399,-117.866093,granted,1100 West Stewart Drive,,Orange,CA,92868,USA,,,,vascular,www.google.com/search?q=St.+Joseph+Hospital+of+Orange+Vascular+Lab,St. Joseph Hospital of Orange Vascular Lab Orange,,,,,,,,,"Apr 30, 2023","Extracranial Cerebrovascular Testing, Peripheral Arterial Testing, Peripheral Venous Testing",,,,,,,,,,,,,,
565,566,St. Jude Heritage Health Care,33.893629,-117.927034,granted,100 East Valencia Mesa,Suite 206,Fullerton,CA,92835,USA,,,,echo,www.google.com/search?q=St.+Jude+Heritage+Health+Care,St. Jude Heritage Health Care Fullerton,,,"Mar 31, 2024","Adult Stress, Adult Transthoracic",,,,,,,,,,,,,,,,,,,,
