,id,name,lat,lng,category,address,address2,city,state,postal,country,phone,web,features,modalities,searchGoogle,search,ct,ct_areas,echo,echo_areas,mr,mr_areas,nuclear,nuclear_areas,vascular,vascular_areas,pediatric_echo,pediatric_echo_areas,ct-dental,ct-dental_areas,stenting,stenting_areas,vein_center,vein_center_areas,cardiac_electrophysiology,cardiac_electrophysiology_areas,cardiovascular_catheterization,cardiovascular_catheterization_areas,jrcdms,jrcdms_areas
0,1,Alpine Orthopedics and Sports Medicine,45.673604,-111.104212,granted,"536 Cottonwood Rd., Suite 100",,Bozeman,MT,59718,USA,,www.alpineorthopedics.com,,mr,,Alpine Orthopedics and Sports Medicine Bozeman,,,,,"Feb 29, 2024",Musculoskeletal MRI,,,,,,,,,,,,,,,,,,
1,2,Bellamah Vein Center,46.902284,-114.036894,multigranted,2975 Stockyard Rd.,Ste 200,Missoula,MT,59808,USA,,veinmontana.com/,,"vascular, vein_center",,Bellamah Vein Center Missoula,,,,,,,,,"Apr 30, 2024",Peripheral Venous Testing,,,,,,,"May 31, 2024",Superficial Venous Evaluation and Management,,,,,,
2,3,Big Sky Diagnostic Imaging,46.008213,-112.547569,multigranted,"401 S. Alabama St., Ste. 7",,Butte,MT,59701,USA,,,,"ct, mr",www.google.com/search?q=Big+Sky+Diagnostic+Imaging,Big Sky Diagnostic Imaging Butte,"Sep 30, 2023","Body CT, Neurological CT, Vascular CTA | Maxillofacial CT",,,"Sep 30, 2023","Musculoskeletal MRI, Neurological MRI",,,,,,,,,,,,,,,,,,
3,4,Bozeman Health Cardiology Consultants,45.670385,-111.017232,granted,937 Highland Boulevard,Suite 5510,Bozeman,MT,59715,USA,,www.bozemandeaconess.org,,echo,,Bozeman Health Cardiology Consultants Bozeman,,,"Oct 31, 2022","Adult Stress, Adult Transthoracic",,,,,,,,,,,,,,,,,,,,
4,5,Bozeman Health Cardiology Consultants,45.671144,-111.017152,granted,915 Highland Boulevard,,Bozeman,MT,59715,USA,,,,echo,www.google.com/search?q=Bozeman+Health+Cardiology+Consultants,Bozeman Health Cardiology Consultants Bozeman,,,"Oct 31, 2022","Adult Stress, Adult Transthoracic",,,,,,,,,,,,,,,,,,,,
5,6,Bridger Orthopedic and Sports Medicine,45.671758,-111.016187,granted,1450 Ellis Street,Suite 201,Bozeman,MT,59715,USA,,www.bridgerorthopedic.com,,mr,,Bridger Orthopedic and Sports Medicine Bozeman,,,,,"Feb 28, 2023","Musculoskeletal MRI, Neurological MRI",,,,,,,,,,,,,,,,,,
6,7,CardioVascular Consultants of Montana,45.793195,-108.514402,granted,1101 North 27th Street,Suite F,Billings,MT,59101,USA,,,,echo,www.google.com/search?q=CardioVascular+Consultants+of+Montana,CardioVascular Consultants of Montana Billings,,,"Sep 29, 2022","Adult Stress, Adult Transthoracic",,,,,,,,,,,,,,,,,,,,
7,8,"Ear, Nose and Throat Associates",45.792893,-108.518498,granted,2900 12th Avenue North,Suite 330w,Billings,MT,59101,USA,,,,ct,"www.google.com/search?q=Ear,+Nose+and+Throat+Associates","Ear, Nose and Throat Associates Billings","Mar 31, 2024",Maxillofacial CT,,,,,,,,,,,,,,,,,,,,,,
8,9,"Glacier Ear, Nose, and Throat, Head and Neck Surgery, PC",48.218192,-114.328166,granted,160 Heritage Way,,Kalispell,MT,59901,USA,,glacierentclinic.com,,ct,,"Glacier Ear, Nose, and Throat, Head and Neck Surgery, PC Kalispell","Nov 30, 2023",Maxillofacial CT,,,,,,,,,,,,,,,,,,,,,,
9,10,Helena Cardiology Clinic,46.580635,-111.995344,granted,32 Medical Park Drive,,Helena,MT,59601,USA,,,,echo,www.google.com/search?q=Helena+Cardiology+Clinic,Helena Cardiology Clinic Helena,,,"Sep 30, 2024","Adult Stress, Adult Transesophageal, Adult Transthoracic",,,,,,,,,,,,,,,,,,,,
10,11,International Heart Institute - Butte,46.007694,-112.54499,granted,"435 South Crystal, Suite 300",,Butte,MT,59701,USA,,www.saintpatrick.org,,echo,,International Heart Institute - Butte Butte,,,"Jun 30, 2024","Adult Stress, Adult Transthoracic",,,,,,,,,,,,,,,,,,,,
11,12,International Heart Institute - Montana Cardiology,46.88424,-114.03239,granted,"2829 Great Northern Loop, Suite 300",,Missoula,MT,59808,USA,,www.saintpatrick.org,,echo,,International Heart Institute - Montana Cardiology Missoula,,,"Jun 30, 2024",Adult Transthoracic,,,,,,,,,,,,,,,,,,,,
12,13,Logan Health,48.215685,-114.324753,granted,310 Sunnyview Lane,,Kalispell,MT,59901,USA,,nwhc.org,,echo,,Logan Health Kalispell,,,"Feb 28, 2023","Adult Stress, Adult Transesophageal, Adult Transthoracic",,,,,,,,,,,,,,,,,,,,
13,14,Missoula Bone and Joint,46.883083,-114.031548,granted,2360 Mullan Road,Suite C,Missoula,MT,59808,USA,,missoulaboneandjoint.com,,mr,,Missoula Bone and Joint Missoula,,,,,"Aug 31, 2023","Musculoskeletal MRI, Neurological MRI",,,,,,,,,,,,,,,,,,
14,15,Ortho Montana PSC,45.792893,-108.518498,granted,2900 12th Avenue,Suite 140W,Billings,MT,59101,USA,,,,mr,www.google.com/search?q=Ortho+Montana+PSC,Ortho Montana PSC Billings,,,,,"Aug 31, 2025",Musculoskeletal MRI,,,,,,,,,,,,,,,,,,
15,16,Providence - St. Patrick Hospital,46.873905,-113.999891,granted,500 West Broadway,,Missoula,MT,59802,USA,,www.saintpatrick.org,,echo,,Providence - St. Patrick Hospital Missoula,,,"Jun 30, 2024","Adult Stress, Adult Transesophageal, Adult Transthoracic",,,,,,,,,,,,,,,,,,,,
16,17,"Rocky Mountain Ear, Nose and Throat Center, PC",46.851572,-114.009152,granted,700 West Kent,,Missoula,MT,59801,USA,,,,ct,"www.google.com/search?q=Rocky+Mountain+Ear,+Nose+and+Throat+Center,+PC","Rocky Mountain Ear, Nose and Throat Center, PC Missoula","Feb 29, 2024",Maxillofacial CT,,,,,,,,,,,,,,,,,,,,,,
17,18,Seattle Children’s Pediatric Cardiology of Montana,47.486076,-111.263578,granted,2510 Bobcat Way,,Great Falls,MT,59405,USA,,,,pediatric_echo,www.google.com/search?q=Seattle+Children’s+Pediatric+Cardiology+of+Montana,Seattle Children’s Pediatric Cardiology of Montana Great Falls,,,,,,,,,,,"Feb 28, 2025","Pediatric Transthoracic, Fetal",,,,,,,,,,,,
18,19,St Peters Health,46.584213,-111.994975,granted,2475 E .Broadway St,,Helena,MT,59635,USA,,stpetershealth.org,,echo,,St Peters Health Helena,,,"Nov 30, 2024",Adult Transthoracic,,,,,,,,,,,,,,,,,,,,
19,20,St Peters Health Cardiology,46.578199,-112.076964,granted,2550 Broadway,Attn. Cardiology,Helena,MT,59601,USA,,,,echo,www.google.com/search?q=St+Peters+Health+Cardiology,St Peters Health Cardiology Helena,,,"Nov 30, 2024","Adult Stress, Adult Transthoracic",,,,,,,,,,,,,,,,,,,,
